{
  "$schema": "https://raw.githubusercontent.com/gruncellka/porto-data/refs/heads/main/porto_data/schemas/prices.schema.json",
  "file_type": "prices",
  "provider": "deutschepost",
  "unit": {
    "price": "cents",
    "currency": "EUR"
  },
  "prices": {
    "product_prices": [
      {
        "product_id": "standardbrief",
        "zone": "domestic",
        "weight_tier": "W0020",
        "price": [
          {
            "amount": 95,
            "effective_from": "2025-01-01",
            "effective_to": null
          }
        ]
      },
      {
        "product_id": "standardbrief",
        "zone": "zone_1_eu",
        "weight_tier": "W0020",
        "price": [
          {
            "amount": 125,
            "effective_from": "2025-01-01",
            "effective_to": null
          }
        ]
      },
      {
        "product_id": "standardbrief",
        "zone": "zone_2_europe",
        "weight_tier": "W0020",
        "price": [
          {
            "amount": 155,
            "effective_from": "2025-01-01",
            "effective_to": null
          }
        ]
      },
      {
        "product_id": "standardbrief",
        "zone": "world",
        "weight_tier": "W0020",
        "price": [
          {
            "amount": 125,
            "effective_from": "2025-01-01",
            "effective_to": null
          }
        ]
      },
      {
        "product_id": "kompaktbrief",
        "zone": "domestic",
        "weight_tier": "W0050",
        "price": [
          {
            "amount": 110,
            "effective_from": "2025-01-01",
            "effective_to": null
          }
        ]
      },
      {
        "product_id": "kompaktbrief",
        "zone": "zone_1_eu",
        "weight_tier": "W0050",
        "price": [
          {
            "amount": 180,
            "effective_from": "2025-01-01",
            "effective_to": null
          }
        ]
      },
      {
        "product_id": "kompaktbrief",
        "zone": "zone_2_europe",
        "weight_tier": "W0050",
        "price": [
          {
            "amount": 220,
            "effective_from": "2025-01-01",
            "effective_to": null
          }
        ]
      },
      {
        "product_id": "kompaktbrief",
        "zone": "world",
        "weight_tier": "W0050",
        "price": [
          {
            "amount": 180,
            "effective_from": "2025-01-01",
            "effective_to": null
          }
        ]
      },
      {
        "product_id": "grossbrief",
        "zone": "domestic",
        "weight_tier": "W0500",
        "price": [
          {
            "amount": 180,
            "effective_from": "2025-01-01",
            "effective_to": null
          }
        ]
      },
      {
        "product_id": "grossbrief",
        "zone": "zone_1_eu",
        "weight_tier": "W0500",
        "price": [
          {
            "amount": 330,
            "effective_from": "2025-01-01",
            "effective_to": null
          }
        ]
      },
      {
        "product_id": "grossbrief",
        "zone": "zone_2_europe",
        "weight_tier": "W0500",
        "price": [
          {
            "amount": 420,
            "effective_from": "2025-01-01",
            "effective_to": null
          }
        ]
      },
      {
        "product_id": "grossbrief",
        "zone": "world",
        "weight_tier": "W0500",
        "price": [
          {
            "amount": 330,
            "effective_from": "2025-01-01",
            "effective_to": null
          }
        ]
      },
      {
        "product_id": "maxibrief",
        "zone": "domestic",
        "weight_tier": "W1000",
        "price": [
          {
            "amount": 290,
            "effective_from": "2025-01-01",
            "effective_to": null
          }
        ]
      },
      {
        "product_id": "maxibrief",
        "zone": "zone_1_eu",
        "weight_tier": "W1000",
        "price": [
          {
            "amount": 650,
            "effective_from": "2025-01-01",
            "effective_to": null
          }
        ]
      },
      {
        "product_id": "maxibrief",
        "zone": "zone_2_europe",
        "weight_tier": "W1000",
        "price": [
          {
            "amount": 800,
            "effective_from": "2025-01-01",
            "effective_to": null
          }
        ]
      },
      {
        "product_id": "maxibrief",
        "zone": "world",
        "weight_tier": "W1000",
        "price": [
          {
            "amount": 650,
            "effective_from": "2025-01-01",
            "effective_to": null
          }
        ]
      }
    ],
    "service_prices": [
      {
        "service_id": "einschreiben",
        "price": [
          {
            "amount": 265,
            "effective_from": "2025-01-01",
            "effective_to": null
          }
        ]
      },
      {
        "service_id": "einschreiben_einwurf",
        "price": [
          {
            "amount": 235,
            "effective_from": "2025-01-01",
            "effective_to": null
          }
        ]
      },
      {
        "service_id": "einschreiben_rueckschein",
        "price": [
          {
            "amount": 485,
            "effective_from": "2025-01-01",
            "effective_to": null
          }
        ]
      },
      {
        "service_id": "zusatzversicherung",
        "price": [
          {
            "amount": 250,
            "effective_from": "2025-01-01",
            "effective_to": null
          }
        ]
      }
    ]
  }
}
